{
    "id": 112,
    "item": {
        "name": "tm07",
        "url": "http://localhost/api/v2/item/311/"
    },
    "move": {
        "name": "hail",
        "url": "http://localhost/api/v2/move/258/"
    },
    "version_group": {
        "name": "heartgold-soulsilver",
        "url": "http://localhost/api/v2/version-group/10/"
    }
}
