{
    "id": 1199,
    "item": {
        "name": "hm06",
        "url": "http://127.0.0.1:8000/api/v2/item/402/"
    },
    "move": {
        "name": "rock-smash",
        "url": "http://127.0.0.1:8000/api/v2/move/249/"
    },
    "version_group": {
        "name": "ruby-sapphire",
        "url": "http://127.0.0.1:8000/api/v2/version-group/5/"
    }
}
