{
    "id": 1175,
    "item": {
        "name": "tm91",
        "url": "http://localhost/api/v2/item/395/"
    },
    "move": {
        "name": "flash-cannon",
        "url": "http://localhost/api/v2/move/430/"
    },
    "version_group": {
        "name": "black-2-white-2",
        "url": "http://localhost/api/v2/version-group/14/"
    }
}
