{
    "id": 105,
    "item": {
        "name": "tm07",
        "url": "http://localhost/api/v2/item/311/"
    },
    "move": {
        "name": "zap-cannon",
        "url": "http://localhost/api/v2/move/192/"
    },
    "version_group": {
        "name": "gold-silver",
        "url": "http://localhost/api/v2/version-group/3/"
    }
}
