{
    "id": 363,
    "item": {
        "name": "tm23",
        "url": "http://127.0.0.1:8000/api/v2/item/327/"
    },
    "move": {
        "name": "smack-down",
        "url": "http://127.0.0.1:8000/api/v2/move/479/"
    },
    "version_group": {
        "name": "black-white",
        "url": "http://127.0.0.1:8000/api/v2/version-group/11/"
    }
}
