{
    "id": 111,
    "item": {
        "name": "tm07",
        "url": "http://localhost/api/v2/item/311/"
    },
    "move": {
        "name": "hail",
        "url": "http://localhost/api/v2/move/258/"
    },
    "version_group": {
        "name": "x-y",
        "url": "http://localhost/api/v2/version-group/15/"
    }
}
