{
    "id": 1065,
    "item": {
        "name": "tm88",
        "url": "http://127.0.0.1:8000/api/v2/item/392/"
    },
    "move": {
        "name": "sleep-talk",
        "url": "http://127.0.0.1:8000/api/v2/move/214/"
    },
    "version_group": {
        "name": "x-y",
        "url": "http://127.0.0.1:8000/api/v2/version-group/15/"
    }
}
