{
    "id": 421,
    "item": {
        "name": "tm27",
        "url": "http://127.0.0.1:8000/api/v2/item/331/"
    },
    "move": {
        "name": "return",
        "url": "http://127.0.0.1:8000/api/v2/move/216/"
    },
    "version_group": {
        "name": "ruby-sapphire",
        "url": "http://127.0.0.1:8000/api/v2/version-group/5/"
    }
}
