{
    "id": 852,
    "item": {
        "name": "tm58",
        "url": "http://localhost/api/v2/item/362/"
    },
    "move": {
        "name": "endure",
        "url": "http://localhost/api/v2/move/203/"
    },
    "version_group": {
        "name": "heartgold-soulsilver",
        "url": "http://localhost/api/v2/version-group/10/"
    }
}
