{
    "id": 617,
    "item": {
        "name": "tm39",
        "url": "http://127.0.0.1:8000/api/v2/item/343/"
    },
    "move": {
        "name": "rock-tomb",
        "url": "http://127.0.0.1:8000/api/v2/move/317/"
    },
    "version_group": {
        "name": "platinum",
        "url": "http://127.0.0.1:8000/api/v2/version-group/9/"
    }
}
