{
    "id": 1168,
    "item": {
        "name": "hm04",
        "url": "http://127.0.0.1:8000/api/v2/item/400/"
    },
    "move": {
        "name": "strength",
        "url": "http://127.0.0.1:8000/api/v2/move/70/"
    },
    "version_group": {
        "name": "crystal",
        "url": "http://127.0.0.1:8000/api/v2/version-group/4/"
    }
}
