{
    "id": 21,
    "item": {
        "name": "tm02",
        "url": "http://localhost/api/v2/item/306/"
    },
    "move": {
        "name": "headbutt",
        "url": "http://localhost/api/v2/move/29/"
    },
    "version_group": {
        "name": "crystal",
        "url": "http://localhost/api/v2/version-group/4/"
    }
}
