{
    "id": 979,
    "item": {
        "name": "tm76",
        "url": "http://localhost/api/v2/item/380/"
    },
    "move": {
        "name": "struggle-bug",
        "url": "http://localhost/api/v2/move/522/"
    },
    "version_group": {
        "name": "black-white",
        "url": "http://localhost/api/v2/version-group/11/"
    }
}
