{
    "id": 1107,
    "item": {
        "name": "tm96",
        "url": "http://127.0.0.1:8000/api/v2/item/745/"
    },
    "move": {
        "name": "nature-power",
        "url": "http://127.0.0.1:8000/api/v2/move/267/"
    },
    "version_group": {
        "name": "x-y",
        "url": "http://127.0.0.1:8000/api/v2/version-group/15/"
    }
}
