{
    "id": 1093,
    "item": {
        "name": "tm92",
        "url": "http://127.0.0.1:8000/api/v2/item/396/"
    },
    "move": {
        "name": "trick-room",
        "url": "http://127.0.0.1:8000/api/v2/move/433/"
    },
    "version_group": {
        "name": "x-y",
        "url": "http://127.0.0.1:8000/api/v2/version-group/15/"
    }
}
