{
    "id": 530,
    "item": {
        "name": "tm34",
        "url": "http://localhost/api/v2/item/338/"
    },
    "move": {
        "name": "bide",
        "url": "http://localhost/api/v2/move/117/"
    },
    "version_group": {
        "name": "yellow",
        "url": "http://localhost/api/v2/version-group/2/"
    }
}
