{
    "id": 254,
    "item": {
        "name": "tm16",
        "url": "http://localhost/api/v2/item/320/"
    },
    "move": {
        "name": "light-screen",
        "url": "http://localhost/api/v2/move/113/"
    },
    "version_group": {
        "name": "black-2-white-2",
        "url": "http://localhost/api/v2/version-group/14/"
    }
}
