{
    "id": 676,
    "item": {
        "name": "tm43",
        "url": "http://127.0.0.1:8000/api/v2/item/347/"
    },
    "move": {
        "name": "detect",
        "url": "http://127.0.0.1:8000/api/v2/move/197/"
    },
    "version_group": {
        "name": "crystal",
        "url": "http://127.0.0.1:8000/api/v2/version-group/4/"
    }
}
