{
    "id": 1067,
    "item": {
        "name": "tm78",
        "url": "http://localhost/api/v2/item/382/"
    },
    "move": {
        "name": "captivate",
        "url": "http://localhost/api/v2/move/445/"
    },
    "version_group": {
        "name": "diamond-pearl",
        "url": "http://localhost/api/v2/version-group/8/"
    }
}
