{
    "id": 659,
    "item": {
        "name": "tm42",
        "url": "http://127.0.0.1:8000/api/v2/item/346/"
    },
    "move": {
        "name": "dream-eater",
        "url": "http://127.0.0.1:8000/api/v2/move/138/"
    },
    "version_group": {
        "name": "gold-silver",
        "url": "http://127.0.0.1:8000/api/v2/version-group/3/"
    }
}
