{
    "id": 1010,
    "item": {
        "name": "tm70",
        "url": "http://localhost/api/v2/item/374/"
    },
    "move": {
        "name": "aurora-veil",
        "url": "http://localhost/api/v2/move/694/"
    },
    "version_group": {
        "name": "sun-moon",
        "url": "http://localhost/api/v2/version-group/17/"
    }
}
