{
    "id": 717,
    "item": {
        "name": "tm43",
        "url": "http://localhost/api/v2/item/347/"
    },
    "move": {
        "name": "detect",
        "url": "http://localhost/api/v2/move/197/"
    },
    "version_group": {
        "name": "gold-silver",
        "url": "http://localhost/api/v2/version-group/3/"
    }
}
