{
    "id": 345,
    "item": {
        "name": "tm22",
        "url": "http://127.0.0.1:8000/api/v2/item/326/"
    },
    "move": {
        "name": "solar-beam",
        "url": "http://127.0.0.1:8000/api/v2/move/76/"
    },
    "version_group": {
        "name": "platinum",
        "url": "http://127.0.0.1:8000/api/v2/version-group/9/"
    }
}
